id,description,caught_by,files_affected,fix_commit,fix_time_local,class,introduced_time,delta,notes,is_false_positive
E1,?RCI definition wrong in Paper 4 docs (stated as 1 - cosine_similarity(TRUE; COLD) instead of within-condition self-similarity difference).,Codex (audit),docs/Paper4_Results_Discussion.md; docs/Paper4_Entanglement_Methods_Appendix.md,413a11c,2026-02-08T18:48:56+05:30,Definition error,Unknown,Unknown,Docs only; code already correct.,no
E2,N mismatch in entanglement correlation (reported N=480 instead of N=240).,Codex (audit),docs/Paper4_Results_Discussion.md; docs/Paper4_Claims_Evidence.md; docs/Paper4_Entanglement_Methods_Appendix.md,413a11c,2026-02-08T18:48:56+05:30,Consistency error,Unknown,Unknown,Pooled points are 8 model-domain runs x 30 positions.,no
E3,Wording inconsistency: ?8 models x 2 domains? vs ?8 model-domain runs?.,Codex (audit),analysis/independence_var_ratio_summary.md,413a11c,2026-02-08T18:48:56+05:30,Consistency error,Unknown,Unknown,Standardized to model-domain runs phrasing.,no
E4,r = -1.000 treated as empirical in ?RCI vs RCI_COLD test; actually exact due to dataset construction (RCI_TRUE ? 1).,Claude Code (audit),analysis/independence_test_summary.md,413a11c,2026-02-08T18:48:56+05:30,Definition error,Unknown,Unknown,Reframed as invalid test for independence.,no
E5,Language correction: ?validated? -> ?supported? for independence claim.,Claude Code (audit),analysis/independence_var_ratio_summary.md,413a11c,2026-02-08T18:48:56+05:30,Consistency error,Unknown,Unknown,Conservative phrasing for statistical support.,no
E6,Documentation gap: Llama anomaly lacked dedicated note (ESI calculation + intact capability + broken coherence framing).,Codex (audit),docs/Llama_Safety_Anomaly.md; docs/Paper4_Results_Discussion.md,b92ffbc,2026-02-08T19:23:39+05:30,Documentation gap,Unknown,Unknown,Position-level evidence added for P30 anomaly.,no
FP1,Var_Ratio = 7.46 not visible in entanglement_variance_summary.csv (mean-only file).,Codex (audit),analysis/entanglement_variance_summary.csv; analysis/entanglement_position_data.csv,N/A,N/A,False positive,N/A,N/A,Not an error; spike exists in position-level data.,yes